{
  "name": "php-8.0.30-bookworm-aarch64",
  "php_version": "8.0.30",
  "branch": "8.0",
  "fixed_in": null,
  "sapi": "apache2handler",
  "verified": false,
  "rce": false,
  "upstream_profile": "bookworm",
  "distro": "debian",
  "arch": "aarch64",
  "libphp": {
    "zif_system": "0x31ef70",
    "zval_ptr_dtor": "0x40ddb0"
  },
  "stages": {},
  "config": {
    "memory_limit": 8388608,
    "display_errors": "On",
    "workers": 1
  },
  "status": "offsets only; heap not calibrated (EOL branch)"
}