{
  "name": "php-8.3.35-bookworm-aarch64",
  "php_version": "8.3.35",
  "branch": "8.3",
  "fixed_in": "8.3.36",
  "sapi": "apache2handler",
  "verified": false,
  "rce": false,
  "upstream_profile": "bookworm",
  "libphp": {
    "zif_system": "0x377428",
    "zval_ptr_dtor": "0x46fcc0",
    "htdata": null
  },
  "stages": {
    "stage1_n": 841,
    "stage1_forge_len": 63,
    "stage2_t": 406,
    "stage2_v": 16,
    "stage3_pads": null,
    "stage3_carrier": null
  },
  "config": {
    "memory_limit": 8388608,
    "display_errors": "On (web SAPI, stage-1 leak succeeded)",
    "session_upload_progress": "On",
    "workers": 1
  },
  "measured": {
    "chunk_base": "0xffff84600000",
    "libphp_base": "0xffff866f0000"
  },
  "status": "leaks calibrated; stage 3 not verified",
  "distro": "debian",
  "arch": "aarch64"
}